{
  "$schema": "https://a2a-idf.opena2a.org/schemas/fixture-level-v1.json",
  "name": "levels/level-2-attestation-expired",
  "description": "Negative fixture: an ORGANIZATION_VERIFIED attestation whose registry signature is VALID but whose validity window ended before the pinned validationTime (expiresAt 2025-02-17 < validationTime 2026-07-03). Every other field is well-formed and correctly bound. A conforming verifier MUST reject on the validity window alone. The fixture pins validationTime so the expiry decision is deterministic and never depends on the wall clock.",
  "spec": [
    {
      "id": "A2A-IDF",
      "ref": "https://github.com/a2aproject/A2A/pull/1496",
      "section": "§1 Organization Verification (validity window)"
    },
    {
      "id": "RFC 8785",
      "ref": "https://datatracker.ietf.org/doc/html/rfc8785",
      "section": "JCS canonical form (attestation signing input)"
    },
    {
      "id": "RFC 8032",
      "ref": "https://datatracker.ietf.org/doc/html/rfc8032",
      "section": "§7.1 Test 2 (registry issuer key)"
    }
  ],
  "level": 2,
  "agentCard": {
    "name": "financial-advisor-agent",
    "provider": {
      "organization": "Example Corp",
      "url": "https://example.com"
    },
    "capabilities": {
      "extensions": [
        {
          "uri": "https://a2a-protocol.org/extensions/agent-identity",
          "description": "Agent identity verification and trust signals",
          "required": false,
          "params": {
            "version": "1.0.0",
            "identityLevel": "ORGANIZATION_VERIFIED",
            "agentId": "urn:a2a:agent:example.com:financial-advisor:v2",
            "publicKey": {
              "kty": "OKP",
              "crv": "Ed25519",
              "x": "11qYAYKxCrfVS_7TyWQHOg7hcvPapiMlrwIaaPcHURo",
              "kid": "agent-a1b2c3d4"
            },
            "attestations": [
              {
                "type": "organization",
                "issuer": {
                  "name": "A2A Trust Registry",
                  "kid": "registry-x1y2z3",
                  "url": "https://trust.a2a-registry.org"
                },
                "subject": {
                  "organization": "Example Corp",
                  "agentId": "urn:a2a:agent:example.com:financial-advisor:v2",
                  "kid": "agent-a1b2c3d4"
                },
                "verifiedAt": "2024-02-17T00:00:00Z",
                "expiresAt": "2025-02-17T00:00:00Z",
                "signature": "EsoFAXKwgcIOxgxjl59QgGTfcH1TUf60mi-6gtAq10wsuGMGr2niiE94eiJRiq3aB9k5xZRNRU3Rs9m44ethDA"
              }
            ]
          }
        }
      ]
    }
  },
  "evidence": {
    "issuerPublicKey": {
      "kty": "OKP",
      "crv": "Ed25519",
      "x": "PUAXw-hDiVqStwqnTRt-vJyYLM8uxJaMwM1V8Sr0Zgw",
      "kid": "registry-x1y2z3"
    },
    "validationTime": "2026-07-03T00:00:00Z"
  },
  "expected": {
    "verifyResult": "REJECT",
    "rejectCategory": "EXPIRED"
  }
}
