{
  "$schema": "https://a2a-idf.opena2a.org/schemas/fixture-level-v1.json",
  "name": "levels/level-2-jcs-utf16-key-order",
  "description": "Level 2 (ORGANIZATION_VERIFIED) with an annotations object whose ASCII property names sort differently under RFC 8785 §3.2.3 than under two common alternatives. JCS compares property names as UTF-16 code units, so 10 sorts before 9 (digits compare as characters, not as numbers) and B and Z sort before _ and a (upper case before lower case). The registry signed that order. A conforming verifier ACCEPTs; a verifier that sorts numerically, case-insensitively or by locale collation reconstructs a different signing input and reports a spurious SIGNATURE_INVALID. The non-ASCII half of the rule, code units against code points, is pinned by level-2-attestation-non-bmp-keys.",
  "spec": [
    {
      "id": "A2A-IDF",
      "ref": "https://github.com/a2aproject/A2A/pull/1496",
      "section": "§1 Organization Verification (registry attestation)"
    },
    {
      "id": "RFC 8785",
      "ref": "https://datatracker.ietf.org/doc/html/rfc8785",
      "section": "§3.2.3 Sorting of Object Properties (UTF-16 code units)"
    },
    {
      "id": "RFC 8032",
      "ref": "https://datatracker.ietf.org/doc/html/rfc8032",
      "section": "§7.1 Test 1 (agent key), Test 2 (registry issuer key)"
    }
  ],
  "level": 2,
  "agentCard": {
    "name": "financial-advisor-agent",
    "provider": {
      "organization": "Example Corp",
      "url": "https://example.com"
    },
    "capabilities": {
      "extensions": [
        {
          "uri": "https://a2a-protocol.org/extensions/agent-identity",
          "description": "Agent identity verification and trust signals",
          "required": false,
          "params": {
            "version": "1.0.0",
            "identityLevel": "ORGANIZATION_VERIFIED",
            "agentId": "urn:a2a:agent:example.com:financial-advisor:v2",
            "publicKey": {
              "kty": "OKP",
              "crv": "Ed25519",
              "x": "11qYAYKxCrfVS_7TyWQHOg7hcvPapiMlrwIaaPcHURo",
              "kid": "agent-a1b2c3d4"
            },
            "attestations": [
              {
                "type": "organization",
                "issuer": {
                  "name": "A2A Trust Registry",
                  "kid": "registry-x1y2z3",
                  "url": "https://trust.a2a-registry.org"
                },
                "subject": {
                  "organization": "Example Corp",
                  "agentId": "urn:a2a:agent:example.com:financial-advisor:v2",
                  "kid": "agent-a1b2c3d4"
                },
                "verifiedAt": "2026-02-17T00:00:00Z",
                "expiresAt": "2027-02-17T00:00:00Z",
                "annotations": {
                  "9": "Digit Nine",
                  "10": "Digits One Zero",
                  "a": "Latin Small Letter A",
                  "B": "Latin Capital Letter B",
                  "aa": "Latin Small Letter A, twice",
                  "_": "Low Line",
                  "Z": "Latin Capital Letter Z"
                },
                "signature": "uIVii89GZDIiEe7dXQeF5br8vW6DB4sh-kRkkbxto-uJLI7RJjf9w91b1S0eFNb8vOmqQh0bJNn62-JnzRgGBg"
              }
            ]
          }
        }
      ]
    }
  },
  "evidence": {
    "issuerPublicKey": {
      "kty": "OKP",
      "crv": "Ed25519",
      "x": "PUAXw-hDiVqStwqnTRt-vJyYLM8uxJaMwM1V8Sr0Zgw",
      "kid": "registry-x1y2z3"
    },
    "validationTime": "2026-07-03T00:00:00Z"
  },
  "expected": {
    "verifyResult": "ACCEPT"
  }
}
