{
  "$schema": "https://a2a-idf.opena2a.org/schemas/fixture-level-v1.json",
  "name": "levels/level-2-multi-defect-subject-and-evidence",
  "description": "Check-order fixture with two defects: the validly signed attestation's subject.kid (agent-e5f6a7b8) does not match the declared publicKey.kid (agent-a1b2c3d4), a SUBJECT_MISMATCH, and evidence omits validationTime, a SHAPE_INVALID. The subject binding check precedes the evidence shape check in the contract order, so a conforming verifier MUST reject with SUBJECT_MISMATCH. A verifier that runs every shape check before any binding check reports SHAPE_INVALID and fails this fixture.",
  "spec": [
    {
      "id": "A2A-IDF",
      "ref": "https://github.com/a2aproject/A2A/pull/1496",
      "section": "§1 Organization Verification (check order: subject binding before evidence shape)"
    },
    {
      "id": "RFC 8785",
      "ref": "https://datatracker.ietf.org/doc/html/rfc8785",
      "section": "JCS canonical form (attestation signing input)"
    },
    {
      "id": "RFC 8032",
      "ref": "https://datatracker.ietf.org/doc/html/rfc8032",
      "section": "§7.1 Test 2 (registry issuer key)"
    }
  ],
  "level": 2,
  "agentCard": {
    "name": "financial-advisor-agent",
    "provider": {
      "organization": "Example Corp",
      "url": "https://example.com"
    },
    "capabilities": {
      "extensions": [
        {
          "uri": "https://a2a-protocol.org/extensions/agent-identity",
          "description": "Agent identity verification and trust signals",
          "required": false,
          "params": {
            "version": "1.0.0",
            "identityLevel": "ORGANIZATION_VERIFIED",
            "agentId": "urn:a2a:agent:example.com:financial-advisor:v2",
            "publicKey": {
              "kty": "OKP",
              "crv": "Ed25519",
              "x": "11qYAYKxCrfVS_7TyWQHOg7hcvPapiMlrwIaaPcHURo",
              "kid": "agent-a1b2c3d4"
            },
            "attestations": [
              {
                "type": "organization",
                "issuer": {
                  "name": "A2A Trust Registry",
                  "kid": "registry-x1y2z3",
                  "url": "https://trust.a2a-registry.org"
                },
                "subject": {
                  "organization": "Example Corp",
                  "agentId": "urn:a2a:agent:example.com:financial-advisor:v2",
                  "kid": "agent-e5f6a7b8"
                },
                "verifiedAt": "2026-02-17T00:00:00Z",
                "expiresAt": "2027-02-17T00:00:00Z",
                "signature": "LjAsPl-wx0R__yNL--Wl7SxOgYfq-lXfqvyScsEaeYv7fClrE7MiSNJDYLJ8hOrrpoZJoYmRFxfzN6yn4G5EAg"
              }
            ]
          }
        }
      ]
    }
  },
  "evidence": {
    "issuerPublicKey": {
      "kty": "OKP",
      "crv": "Ed25519",
      "x": "PUAXw-hDiVqStwqnTRt-vJyYLM8uxJaMwM1V8Sr0Zgw",
      "kid": "registry-x1y2z3"
    }
  },
  "expected": {
    "verifyResult": "REJECT",
    "rejectCategory": "SUBJECT_MISMATCH"
  }
}
