{
  "$schema": "https://a2a-idf.opena2a.org/schemas/fixture-level-v1.json",
  "name": "levels/level-1-provider-url-ipv4-number",
  "description": "Negative fixture: the DOMAIN_VERIFIED AgentCard whose provider.url is https://0x7f.0.0.1, while the domain attestation, the agentId and the DNS TXT record name all spell the host the same way, 0x7f.0.0.1. A host whose last label is a number is an IPv4 address, and the WHATWG URL parser reports it in dotted-decimal form: the provider domain is 127.0.0.1. A conforming verifier MUST reject: no binding names 127.0.0.1. A verifier that compares the host as written accepts, and so treats two spellings of one address as two domains.",
  "spec": [
    {
      "id": "A2A-IDF",
      "ref": "https://github.com/a2aproject/A2A/pull/1496",
      "section": "§1 Agent Identity Verification Levels — Level 1 DNS Verification (numeric provider host)"
    },
    {
      "id": "RFC 8032",
      "ref": "https://datatracker.ietf.org/doc/html/rfc8032",
      "section": "§7.1 (Ed25519 test keypairs)"
    },
    {
      "id": "WHATWG URL",
      "ref": "https://url.spec.whatwg.org/",
      "section": "host parsing (IPv4 parser)"
    }
  ],
  "level": 1,
  "agentCard": {
    "name": "financial-advisor-agent",
    "provider": {
      "organization": "Example Corp",
      "url": "https://0x7f.0.0.1"
    },
    "capabilities": {
      "extensions": [
        {
          "uri": "https://a2a-protocol.org/extensions/agent-identity",
          "description": "Agent identity verification and trust signals",
          "required": false,
          "params": {
            "version": "1.0.0",
            "identityLevel": "DOMAIN_VERIFIED",
            "agentId": "urn:a2a:agent:0x7f.0.0.1:financial-advisor:v2",
            "publicKey": {
              "kty": "OKP",
              "crv": "Ed25519",
              "x": "11qYAYKxCrfVS_7TyWQHOg7hcvPapiMlrwIaaPcHURo",
              "kid": "agent-a1b2c3d4"
            },
            "attestations": [
              {
                "type": "domain",
                "domain": "0x7f.0.0.1",
                "verifiedAt": "2026-02-17T00:00:00Z",
                "method": "DNS_TXT"
              }
            ]
          }
        }
      ]
    }
  },
  "evidence": {
    "dnsTxt": {
      "recordName": "_a2a-identity.0x7f.0.0.1",
      "recordValue": "v=a2a1; agent=financial-advisor; kid=agent-a1b2c3d4; fp=If4x36FUomFia_hUBG_SJxt77UtqvkWqWId-9H-XIbk"
    }
  },
  "expected": {
    "verifyResult": "REJECT",
    "rejectCategory": "DOMAIN_MISMATCH"
  }
}
