{
  "$schema": "https://a2a-idf.opena2a.org/schemas/fixture-level-v1.json",
  "name": "levels/level-2-attestation-non-bmp-keys",
  "description": "Level 2 (ORGANIZATION_VERIFIED): the valid organization attestation with one additional member, rfc8785SortingExample, whose property names are the RFC 8785 §3.2.3 sorting example. That set contains a key outside the Basic Multilingual Plane (U+1F600) and a key in U+E000-U+FFFF (U+FB33), so ordering by UTF-16 code units (required) and by Unicode code points (not conforming) produce different signing inputs. The registry signed the UTF-16-ordered JCS form. A conforming verifier includes the unknown member in the signing input, sorts it per RFC 8785 §3.2.3, and ACCEPTs; a verifier that sorts by code point reconstructs different bytes and rejects with SIGNATURE_INVALID.",
  "spec": [
    {
      "id": "A2A-IDF",
      "ref": "https://github.com/a2aproject/A2A/pull/1496",
      "section": "§1 Organization Verification (registry attestation)"
    },
    {
      "id": "RFC 8785",
      "ref": "https://datatracker.ietf.org/doc/html/rfc8785",
      "section": "§3.2.3 Sorting of Object Properties (UTF-16 code units)"
    },
    {
      "id": "RFC 8032",
      "ref": "https://datatracker.ietf.org/doc/html/rfc8032",
      "section": "§7.1 Test 1 (agent key), Test 2 (registry issuer key)"
    }
  ],
  "level": 2,
  "agentCard": {
    "name": "financial-advisor-agent",
    "provider": {
      "organization": "Example Corp",
      "url": "https://example.com"
    },
    "capabilities": {
      "extensions": [
        {
          "uri": "https://a2a-protocol.org/extensions/agent-identity",
          "description": "Agent identity verification and trust signals",
          "required": false,
          "params": {
            "version": "1.0.0",
            "identityLevel": "ORGANIZATION_VERIFIED",
            "agentId": "urn:a2a:agent:example.com:financial-advisor:v2",
            "publicKey": {
              "kty": "OKP",
              "crv": "Ed25519",
              "x": "11qYAYKxCrfVS_7TyWQHOg7hcvPapiMlrwIaaPcHURo",
              "kid": "agent-a1b2c3d4"
            },
            "attestations": [
              {
                "type": "organization",
                "issuer": {
                  "name": "A2A Trust Registry",
                  "kid": "registry-x1y2z3",
                  "url": "https://trust.a2a-registry.org"
                },
                "subject": {
                  "organization": "Example Corp",
                  "agentId": "urn:a2a:agent:example.com:financial-advisor:v2",
                  "kid": "agent-a1b2c3d4"
                },
                "verifiedAt": "2026-02-17T00:00:00Z",
                "expiresAt": "2027-02-17T00:00:00Z",
                "rfc8785SortingExample": {
                  "1": "One",
                  "€": "Euro Sign",
                  "\r": "Carriage Return",
                  "דּ": "Hebrew Letter Dalet With Dagesh",
                  "😀": "Emoji: Grinning Face",
                  "": "Control",
                  "ö": "Latin Small Letter O With Diaeresis"
                },
                "signature": "kRkSVnuposGLoK4SOh9K5fPywOY_24gMGPetE0jLkAjEsxuwPoYHaiDuMrDsFn5UoSQBUuIUAB3VOveUW1UjDw"
              }
            ]
          }
        }
      ]
    }
  },
  "evidence": {
    "issuerPublicKey": {
      "kty": "OKP",
      "crv": "Ed25519",
      "x": "PUAXw-hDiVqStwqnTRt-vJyYLM8uxJaMwM1V8Sr0Zgw",
      "kid": "registry-x1y2z3"
    },
    "validationTime": "2026-07-03T00:00:00Z"
  },
  "expected": {
    "verifyResult": "ACCEPT"
  }
}
